{
  "$schema": "../schemas/team.schema.json",
  "schema_version": "1.0",
  "name": "plot-generation-team",
  "display_name": "플롯 생성 팀",
  "description": "5명 에이전트가 collaborative 모드로 회차별 플롯을 생성하는 팀. plot-architect가 초안을 만들고 arc-designer, lore-keeper, character-designer, engagement-optimizer가 검증.",
  "category": "planning",
  "agents": [
    {
      "agent": "plot-architect",
      "role": "lead",
      "responsibility": "회차별 플롯 초안 생성 + 검증 피드백 반영 + 최종 chapter_N.json 확정. plot-strategy.json 참조.",
      "model": "opus"
    },
    {
      "agent": "arc-designer",
      "role": "worker",
      "responsibility": "아크 진행률, 복선 plant/payoff 타이밍, 훅 배치 검증. plot-strategy.json의 foreshadowing_schedule과 대조.",
      "model": "sonnet"
    },
    {
      "agent": "lore-keeper",
      "role": "worker",
      "responsibility": "세계관 정합성, 타임라인 일관성, 장소/종족 설정 준수 검증.",
      "model": "sonnet"
    },
    {
      "agent": "character-designer",
      "role": "worker",
      "responsibility": "캐릭터 동선, 성장 아크, 관계 발전, 행동 동기 검증. 캐릭터가 아크에서 벗어나지 않는지 확인.",
      "model": "sonnet"
    },
    {
      "agent": "engagement-optimizer",
      "role": "validator",
      "responsibility": "reader_promise_contract, binge_architecture, fun_spec 기준으로 회차별 보상, 이탈 위험, 다음 화 클릭 동기를 검증.",
      "model": "sonnet"
    }
  ],
  "workflow": {
    "type": "collaborative",
    "steps": [
      {
        "name": "per-chapter-generation",
        "description": "회차별로 반복: plot-architect 초안 → 4명 검증 → plot-architect 반영. 각 회차 완성 후 다음 회차 진행.",
        "agents": ["plot-architect", "arc-designer", "lore-keeper", "character-designer", "engagement-optimizer"],
        "execution": "parallel",
        "output": "chapters/chapter_NNN.json"
      }
    ]
  },
  "coordination": {
    "mode": "orchestrated",
    "lead": "plot-architect",
    "communication": "message-based",
    "lead_protocol": "plot-architect가 TeamCreate로 팀 생성 후 회차별로: (1) 초안 작성 → SendMessage로 검증 요청, (2) 3명이 피드백 → SendMessage로 전달, (3) plot-architect가 반영 후 저장. 1회차당 1라운드."
  },
  "quality_gates": {
    "enabled": false
  },
  "cost_estimate": {
    "tokens_per_agent": 40000,
    "warning_message": "플롯 생성 팀은 5명이 collaborative로 소통합니다 (plot-architect = opus / arc-designer, lore-keeper, character-designer, engagement-optimizer = sonnet). 회차당 약 200K 토큰이 소요될 수 있습니다."
  }
}
