{
  "$schema": "../schemas/team.schema.json",
  "schema_version": "1.0",
  "name": "",
  "display_name": "",
  "description": "",
  "category": "verification",
  "agents": [
    {
      "agent": "",
      "role": "lead",
      "responsibility": ""
    },
    {
      "agent": "",
      "role": "worker",
      "responsibility": ""
    }
  ],
  "workflow": {
    "type": "parallel",
    "steps": [
      {
        "name": "step-1",
        "agents": [],
        "execution": "parallel",
        "output": ""
      }
    ]
  },
  "coordination": {
    "mode": "orchestrated",
    "communication": "task-based"
  },
  "quality_gates": {
    "enabled": false,
    "consensus": "all_pass",
    "thresholds": {},
    "issue_policy": {
      "preserve_issue_codes": true,
      "required_issue_fields": ["code", "severity", "source_agent", "evidence", "directive"],
      "merge_strategy": "dedupe_by_code_highest_severity",
      "severity_order": ["critical", "major", "minor"],
      "critical_blocks_pass": true,
      "directive_priority": "critical_first",
      "provenance_required": true,
      "critical_action": "block"
    }
  },
  "cost_estimate": {
    "tokens_per_agent": 30000,
    "warning_message": ""
  }
}
